Service,Policy Definition,Parameter Requirements,Azure Security Benchmark,CIS,CCMC L3,ISO 27001,NIST SP 800-53 R4,NIST SP 800-171 R2,HIPAA HITRUST 9.2,New Zealand ISM,Parameters,Link
Security Center,Adaptive application controls for defining safe applications should be enabled on your machines,None,AM-6,,,A.12.6.2,CM-11,3.4.9,0607.10h2System.23 - 10.h,SS-4,,https://github.com/Azure/azure-policy/blob/master/built-in-policies/policyDefinitions/Security%20Center/ASC_AdaptiveApplicationControls_Audit.json
Security Center,Adaptive network hardening recommendations should be applied on internet facing virtual machines,None,NS-4,,,,SC-7,3.13.5,0859.09m1Organizational.78 - 09.m,NS-2,,https://github.com/Azure/azure-policy/blob/master/built-in-policies/policyDefinitions/Security%20Center/ASC_AdaptiveNetworkHardenings_Audit.json
Security Center,All network ports should be restricted on network security groups associated to your virtual machine,None,,,,A.13.1.1,SC-7,3.13.5,0858.09m1Organizational.4 - 09.m,,,https://github.com/Azure/azure-policy/blob/master/built-in-policies/policyDefinitions/Security%20Center/ASC_UnprotectedEndpoints_Audit.json
Security Center,Allowlist rules in your adaptive application control policy should be updated,None,,,,,,,,,,https://github.com/Azure/azure-policy/blob/master/built-in-policies/policyDefinitions/Security%20Center/ASC_AdaptiveApplicationControlsUpdate_Audit.json
Security Center,Authorized IP ranges should be defined on Kubernetes Services,None,NS-4,,,,,,,,,https://github.com/Azure/azure-policy/blob/master/built-in-policies/policyDefinitions/Security%20Center/ASC_EnableIpRanges_KubernetesService_Audit.json
Security Center,Auto provisioning of the Log Analytics agent should be enabled on your subscription,None,LT-5,2.11,,,,,1220.09ab3System.56 - 09.ab,,,https://github.com/Azure/azure-policy/blob/master/built-in-policies/policyDefinitions/Security%20Center/ASC_Automatic_provisioning_log_analytics_monitoring_agent.json
Security Center,Azure DDoS Protection Standard should be enabled,None,NS-4,,,,SC-5,,,NS-5,,https://github.com/Azure/azure-policy/blob/master/built-in-policies/policyDefinitions/Security%20Center/ASC_EnableDDoSProtection_Audit.json
Security Center,Azure Defender for App Service should be enabled,None,IR-5,2.2,,,,,,,,https://github.com/Azure/azure-policy/blob/master/built-in-policies/policyDefinitions/Security%20Center/ASC_EnableAdvancedThreatProtectionOnAppServices_Audit.json
Security Center,Azure Defender for Azure SQL Database servers should be enabled,None,IR-5,2.3,,,,,,,,https://github.com/Azure/azure-policy/blob/master/built-in-policies/policyDefinitions/Security%20Center/ASC_EnableAdvancedDataSecurityOnSqlServers_Audit.json
Security Center,Azure Defender for DNS should be enabled,None,,,,,,,,,,
Security Center,Azure Defender for Key Vault should be enabled,None,IR-5,2.8,,,,,,,,https://github.com/Azure/azure-policy/blob/master/built-in-policies/policyDefinitions/Security%20Center/ASC_EnableAdvancedThreatProtectionOnKeyVaults_Audit.json
Security Center,Azure Defender for Kubernetes should be enabled,None,IR-5,2.6,,,,,,,,https://github.com/Azure/azure-policy/blob/master/built-in-policies/policyDefinitions/Security%20Center/ASC_EnableAdvancedThreatProtectionOnKubernetesService_Audit.json
Security Center,Azure Defender for Resource Manager should be enabled,None,,,,,,,,,,
Security Center,Azure Defender for SQL servers on machines should be enabled,None,IR-5,2.4,,,,,,,,https://github.com/Azure/azure-policy/blob/master/built-in-policies/policyDefinitions/Security%20Center/ASC_EnableAdvancedDataSecurityOnSqlServerVirtualMachines_Audit.json
Security Center,Azure Defender for Storage should be enabled,None,IR-5,2.5,,,,,,,,https://github.com/Azure/azure-policy/blob/master/built-in-policies/policyDefinitions/Security%20Center/ASC_EnableAdvancedThreatProtectionOnStorageAccounts_Audit.json
Security Center,Azure Defender for container registries should be enabled,None,IR-5,2.7,,,,,,,,https://github.com/Azure/azure-policy/blob/master/built-in-policies/policyDefinitions/Security%20Center/ASC_EnableAdvancedThreatProtectionOnContainerRegistry_Audit.json
Security Center,Azure Defender for servers should be enabled,None,ES-1,2.1,,,,,,,,https://github.com/Azure/azure-policy/blob/master/built-in-policies/policyDefinitions/Security%20Center/ASC_EnableAdvancedThreatProtectionOnVM_Audit.json
Security Center,Deprecated accounts should be removed from your subscription,None,PA-3,,,A.9.2.6,AC-2,3.1.1,,AC-5,,https://github.com/Azure/azure-policy/blob/master/built-in-policies/policyDefinitions/Security%20Center/ASC_RemoveDeprecatedAccounts_Audit.json
Security Center,Deprecated accounts with owner permissions should be removed from your subscription,None,PA-3,,,A.9.2.6,AC-2,3.1.1,1147.01c2System.456 - 01.c,AC-5,,https://github.com/Azure/azure-policy/blob/master/built-in-policies/policyDefinitions/Security%20Center/ASC_RemoveDeprecatedAccountsWithOwnerPermissions_Audit.json
Security Center,Disk encryption should be applied on virtual machines,None,DP-5,7.2,,A.10.1.1,SC-28 (1),3.13.16,0302.09o2Organizational.1 - 09.o,DM-6,,https://github.com/Azure/azure-policy/blob/master/built-in-policies/policyDefinitions/Security%20Center/ASC_UnencryptedVMDisks_Audit.json
Security Center,Email notification for high severity alerts should be enabled,None,IR-2,2.14,,,,,,,,https://github.com/Azure/azure-policy/blob/master/built-in-policies/policyDefinitions/Security%20Center/ASC_Email_notification.json
Security Center,Email notification to subscription owner for high severity alerts should be enabled,None,IR-2,,,,,3.14.6,,,,https://github.com/Azure/azure-policy/blob/master/built-in-policies/policyDefinitions/Security%20Center/ASC_Email_notification_to_subscription_owner.json
Security Center,Endpoint protection solution should be installed on virtual machine scale sets,None,ES-3,,,,SI-3 (1),3.14.2,0201.09j1Organizational.124 - 09.j,DM-4,,https://github.com/Azure/azure-policy/blob/master/built-in-policies/policyDefinitions/Security%20Center/ASC_VmssMissingEndpointProtection_Audit.json
Security Center,External accounts with owner permissions should be removed from your subscription,None,PA-3,1.3,,A.9.2.5,AC-2,3.1.1,1146.01c2System.23 - 01.c,PRS-5,,https://github.com/Azure/azure-policy/blob/master/built-in-policies/policyDefinitions/Security%20Center/ASC_RemoveExternalAccountsWithOwnerPermissions_Audit.json
Security Center,External accounts with read permissions should be removed from your subscription,None,PA-3,1.3,,,AC-2,3.1.1,,,,https://github.com/Azure/azure-policy/blob/master/built-in-policies/policyDefinitions/Security%20Center/ASC_RemoveExternalAccountsReadPermissions_Audit.json
Security Center,External accounts with write permissions should be removed from your subscription,None,PA-3,1.3,,A.9.2.5,AC-2,3.1.1,,PRS-5,,https://github.com/Azure/azure-policy/blob/master/built-in-policies/policyDefinitions/Security%20Center/ASC_RemoveExternalAccountsWritePermissions_Audit.json
Security Center,Guest Configuration extension should be installed on your machines,None,,,,,,,,,,https://github.com/Azure/azure-policy/blob/master/built-in-policies/policyDefinitions/Security%20Center/ASC_GCExtOnVm.json
Security Center,IP Forwarding on your virtual machine should be disabled,None,NS-4,,,,,,,,,https://github.com/Azure/azure-policy/blob/master/built-in-policies/policyDefinitions/Security%20Center/ASC_IPForwardingOnVirtualMachines_Audit.json
Security Center,Internet-facing virtual machines should be protected with network security groups,None,NS-4,,,,,3.13.5,0814.01n1Organizational.12 - 01.n,NS-2,,https://github.com/Azure/azure-policy/blob/master/built-in-policies/policyDefinitions/Security%20Center/ASC_NetworkSecurityGroupsOnInternetFacingVirtualMachines_Audit.json
Security Center,Kubernetes Services should be upgraded to a non-vulnerable Kubernetes version,None,PV-7,,,,,3.14.1,,,,https://github.com/Azure/azure-policy/blob/master/built-in-policies/policyDefinitions/Security%20Center/ASC_UpgradeVersion_KubernetesService_Audit.json
Security Center,Log Analytics agent health issues should be resolved on your machines,None,LT-5,,,,,,,,,https://github.com/Azure/azure-policy/blob/master/built-in-policies/policyDefinitions/Security%20Center/ASC_ResolveLaHealthIssues.json
Security Center,Log Analytics agent should be installed on your virtual machine for Azure Security Center monitoring,None,LT-5,,,,,,,,,https://github.com/Azure/azure-policy/blob/master/built-in-policies/policyDefinitions/Security%20Center/ASC_InstallLaAgentOnVm.json
Security Center,Log Analytics agent should be installed on your virtual machine scale sets for Azure Security Center monitoring,None,LT-5,,,,,,,,,https://github.com/Azure/azure-policy/blob/master/built-in-policies/policyDefinitions/Security%20Center/ASC_InstallLaAgentOnVmss.json
Security Center,MFA should be enabled accounts with write permissions on your subscription,None,IM-4,1.1,,A.9.4.2,IA-2 (1),3.5.3,11110.01q1Organizational.6 - 01.q,AC-17,,https://github.com/Azure/azure-policy/blob/master/built-in-policies/policyDefinitions/Security%20Center/ASC_EnableMFAForWritePermissions_Audit.json
Security Center,MFA should be enabled on accounts with owner permissions on your subscription,None,IM-4,1.1,,A.9.4.2,IA-2 (1),3.5.3,11109.01q1Organizational.57 - 01.q,AC-17,,https://github.com/Azure/azure-policy/blob/master/built-in-policies/policyDefinitions/Security%20Center/ASC_EnableMFAForOwnerPermissions_Audit.json
Security Center,MFA should be enabled on accounts with read permissions on your subscription,None,IM-4,1.2,,A.9.4.2,IA-2 (2),3.5.3,11111.01q2System.4 - 01.q,AC-17,,https://github.com/Azure/azure-policy/blob/master/built-in-policies/policyDefinitions/Security%20Center/ASC_EnableMFAForReadPermissions_Audit.json
Security Center,Management ports of virtual machines should be protected with just-in-time network access control,None,NS-4,,,,SC-7 (4) Ownership : Microsoft,,0858.09m1Organizational.4 - 09.m,AC-7,,https://github.com/Azure/azure-policy/blob/master/built-in-policies/policyDefinitions/Security%20Center/ASC_JITNetworkAccess_Audit.json
Security Center,Management ports should be closed on your virtual machines,None,NS-1,,,,,,1193.01l2Organizational.13 - 01.l,,,https://github.com/Azure/azure-policy/blob/master/built-in-policies/policyDefinitions/Security%20Center/ASC_OpenManagementPortsOnVirtualMachines_Audit.json
Security Center,Monitor missing Endpoint Protection in Azure Security Center,None,ES-3,7.6,,A.12.6.1,SI-3 (1),3.14.2,0201.09j1Organizational.124 - 09.j,DM-4,,https://github.com/Azure/azure-policy/blob/master/built-in-policies/policyDefinitions/Security%20Center/ASC_MissingEndpointProtection_Audit.json
Security Center,Non-internet-facing virtual machines should be protected with network security groups,None,,,,,,,,,,https://github.com/Azure/azure-policy/blob/master/built-in-policies/policyDefinitions/Security%20Center/ASC_NetworkSecurityGroupsOnInternalVirtualMachines_Audit.json
Security Center,Operating system version should be the most current version for your cloud service roles,None,,,,,,,,,,
Security Center,Role-Based Access Control (RBAC) should be used on Kubernetes Services,None,PA-7,8.5,,,,,1229.09c1Organizational.1 - 09.c,,,https://github.com/Azure/azure-policy/blob/master/built-in-policies/policyDefinitions/Security%20Center/ASC_EnableRBAC_KubernetesService_Audit.json
Security Center,Security Center standard pricing tier should be selected,None,,,,,,,,,,https://github.com/Azure/azure-policy/blob/master/built-in-policies/policyDefinitions/Security%20Center/ASC_Standard_pricing_tier.json
Security Center,Sensitive data in your SQL databases should be classified,None,,,,,,,,,,
Security Center,Service principals should be used to protect your subscriptions instead of management certificates,None,IM-2,,,,,,,,,https://github.com/Azure/azure-policy/blob/master/built-in-policies/policyDefinitions/Security%20Center/ASC_UseServicePrincipalToProtectSubscriptions.json
Security Center,Subnets should be associated with a Network Security Group,None,NS-4,,,,,,0814.01n1Organizational.12 - 01.n,,,https://github.com/Azure/azure-policy/blob/master/built-in-policies/policyDefinitions/Security%20Center/ASC_NetworkSecurityGroupsOnSubnets_Audit.json
Security Center,Subscriptions should have a contact email address for security issues,None,IR-2,2.13,,,,3.14.6,,,,https://github.com/Azure/azure-policy/blob/master/built-in-policies/policyDefinitions/Security%20Center/ASC_Security_contact_email.json
Security Center,System updates on virtual machine scale sets should be installed,None,PV-7,,,,SI-2,3.14.1,1202.09aa1System.1 - 09.aa,PRS-5,,https://github.com/Azure/azure-policy/blob/master/built-in-policies/policyDefinitions/Security%20Center/ASC_VmssMissingSystemUpdates_Audit.json
Security Center,System updates should be installed on your machines,None,PV-7,7.5,,A.12.6.1,SI-2,3.14.1,0201.09j1Organizational.124 - 09.j,PRS-5,,https://github.com/Azure/azure-policy/blob/master/built-in-policies/policyDefinitions/Security%20Center/ASC_MissingSystemUpdates_Audit.json
Security Center,There should be more than one owner assigned to your subscription,None,PA-1,,,A.6.1.2,AC-6 (7),3.1.4,11208.01q1Organizational.8 - 01.q,AC-2,,https://github.com/Azure/azure-policy/blob/master/built-in-policies/policyDefinitions/Security%20Center/ASC_DesignateMoreThanOneOwner_Audit.json
Security Center,Virtual machines' Guest Configuration extension should be deployed with system-assigned managed identity,None,,,,,,,,,,https://github.com/Azure/azure-policy/blob/master/built-in-policies/policyDefinitions/Security%20Center/ASC_GCExtOnVmWithNoSAMI.json
Security Center,Vulnerabilities in Azure Container Registry images should be remediated,None,PV-6,,,,,,,,,https://github.com/Azure/azure-policy/blob/master/built-in-policies/policyDefinitions/Security%20Center/ASC_ContainerRegistryVulnerabilityAssessment_Audit.json
Security Center,Vulnerabilities in container security configurations should be remediated,None,PV-4,,,,,3.11.2,0715.10m2Organizational.8 - 10.m,ISM-3,,https://github.com/Azure/azure-policy/blob/master/built-in-policies/policyDefinitions/Security%20Center/ASC_ContainerBenchmark_Audit.json
Security Center,Vulnerabilities in security configuration on your machines should be remediated,None,PV-4,,,A.12.6.1,SI-2,3.14.1,0718.10m3Organizational.34 - 10.m,ISM-3,,https://github.com/Azure/azure-policy/blob/master/built-in-policies/policyDefinitions/Security%20Center/ASC_OSVulnerabilities_Audit.json
Security Center,Vulnerabilities in security configuration on your virtual machine scale sets should be remediated,None,PV-4,,,,SI-2,3.14.1,0717.10m3Organizational.2 - 10.m,ISM-3,,https://github.com/Azure/azure-policy/blob/master/built-in-policies/policyDefinitions/Security%20Center/ASC_VmssOSVulnerabilities_Audit.json
Security Center,Vulnerabilities on your SQL databases should be remediated,None,PV-6,,,A.12.6.1,SI-2,3.14.1,0716.10m3Organizational.1 - 10.m,ISM-3,,https://github.com/Azure/azure-policy/blob/master/built-in-policies/policyDefinitions/Security%20Center/ASC_SQLDbVulnerabilities_Audit.json
Security Center,Vulnerabilities on your SQL servers on machine should be remediated,None,,,,,,,,,,
Service Bus,All authorization rules except RootManageSharedAccessKey should be removed from Service Bus namespace,None,,,,,,,,,,
Service Bus,Azure Service Bus namespaces should use private link,None,,,,,,,,,,
Service Bus,Resource logs in Service Bus should be enabled,Optional,LT-4,5.3,,,,,1208.09aa3System.1 - 09.aa,,requiredRetentionDays,https://github.com/Azure/azure-policy/blob/master/built-in-policies/policyDefinitions/Service%20Bus/ServiceBus_AuditDiagnosticLog_Audit.json
Service Bus,Service Bus Premium namespaces should use a customer-managed key for encryption,None,,,,,,,,,,
Service Fabric,Service Fabric clusters should have the ClusterProtectionLevel property set to EncryptAndSign,None,DP-5,,,A.10.1.1,,,,,,https://github.com/Azure/azure-policy/blob/master/built-in-policies/policyDefinitions/Service%20Fabric/ServiceFabric_AuditClusterProtectionLevel_Audit.json
Service Fabric,Service Fabric clusters should only use Azure Active Directory for client authentication,None,IM-1,,,A.9.2.3,AC-2 (7),,,AC-2,,https://github.com/Azure/azure-policy/blob/master/built-in-policies/policyDefinitions/Service%20Fabric/ServiceFabric_AuditADAuth_Audit.json
SignalR,Azure SignalR Service should use private link,None,NS-3,,,,,,,,,https://github.com/Azure/azure-policy/blob/master/built-in-policies/policyDefinitions/SignalR/SignalR_PrivateEndpointEnabled_Audit.json
Storage,Azure File Sync should use private link,None,,,,,,,,,,
Storage,Geo-redundant storage should be enabled for Storage Accounts,None,,,,,,,,,,
Storage,HPC Cache accounts should use customer-managed key for encryption,None,,,,,,,,,,
Storage,Public network access should be disabled for Azure File Sync,None,,,,,,,,,,
Storage,Secure transfer to storage accounts should be enabled,None,DP-4,3.1,,A.13.2.1,SC-8 (1),3.13.8,0943.09y1Organizational.1 - 09.y,DM-6,,https://github.com/Azure/azure-policy/blob/master/built-in-policies/policyDefinitions/Storage/Storage_AuditForHTTPSEnabled_Audit.json
Storage,Storage account public access should be disallowed,None,,,,,,,,,,
Storage,Storage accounts should allow access from trusted Microsoft services,None,,3.7,,,,,,,,https://github.com/Azure/azure-policy/blob/master/built-in-policies/policyDefinitions/Storage/StorageAccess_TrustedMicrosoftServices_Audit.json
Storage,Storage accounts should be limited by allowed SKUs,Required,,,,,,,,,listOfAllowedSKUs,
Storage,Storage accounts should be migrated to new Azure Resource Manager resources,None,AM-3,,,A.9.1.2,,,,,,https://github.com/Azure/azure-policy/blob/master/built-in-policies/policyDefinitions/Storage/Classic_AuditForClassicStorages_Audit.json
Storage,Storage accounts should have infrastructure encryption,None,,,,,,,,,,https://github.com/Azure/azure-policy/blob/master/built-in-policies/policyDefinitions/Storage/StorageAccountInfrastructureEncryptionEnabled_Audit.json
Storage,Storage accounts should restrict network access,None,NS-4,3.6,,A.13.1.1,SC-7,3.13.5,0866.09m3Organizational.1516 - 09.m,NS-2,,https://github.com/Azure/azure-policy/blob/master/built-in-policies/policyDefinitions/Storage/Storage_NetworkAcls_Audit.json
Storage,Storage accounts should restrict network access using virtual network rules,None,NS-1,3.6,,,,,,,,https://github.com/Azure/azure-policy/blob/master/built-in-policies/policyDefinitions/Storage/StorageAccountOnlyVnetRulesEnabled_Audit.json
Storage,Storage accounts should use customer-managed key for encryption,None,DP-5,3.9,,,,,,,,https://github.com/Azure/azure-policy/blob/master/built-in-policies/policyDefinitions/Storage/StorageAccountCustomerManagedKeyEnabled_Audit.json
Storage,Storage accounts should use private link,None,,,,,,,,,,
Stream Analytics,Azure Stream Analytics jobs should use customer-managed keys to encrypt data,None,,,,,,,,,,https://github.com/Azure/azure-policy/blob/master/built-in-policies/policyDefinitions/Stream%20Analytics/StreamAnalytics_CMK_Audit.json
Stream Analytics,Resource logs in Azure Stream Analytics should be enabled,Optional,LT-4,5.3,,,,,1207.09aa2System.4 - 09.aa,,requiredRetentionDays,https://github.com/Azure/azure-policy/blob/master/built-in-policies/policyDefinitions/Stream%20Analytics/StreamAnalytics_AuditDiagnosticLog_Audit.json
Synapse,Auditing on Synapse workspace should be enabled,Optional,,,,,,,,,setting,
Synapse,Azure Synapse workspaces should allow outbound data traffic only to approved targets,None,,,,,,,,,,
Synapse,Azure Synapse workspaces should use customer-managed keys to encrypt data at rest,None,,,,,,,,,,https://github.com/Azure/azure-policy/blob/master/built-in-policies/policyDefinitions/Synapse/SynapseWorkspaceCMK_Audit.json
Synapse,Azure Synapse workspaces should use private link,None,,,,,,,,,,
Synapse,IP firewall rules on Azure Synapse workspaces should be removed,None,,,,,,,,,,
Synapse,Managed workspace virtual network on Azure Synapse workspaces should be enabled,None,,,,,,,,,,
Synapse,Synapse managed private endpoints should only connect to resources in approved Azure Active Directory tenants,Required,,,,,,,,,allowedTenantIds,
Synapse,Synapse workspace auditing settings should have action groups configured to capture critical activities,None,,,,,,,,,,
Synapse,Synapse workspaces should be configured with 90 days auditing retention or higher.,None,,,,,,,,,,
Synapse,Vulnerability assessment should be enabled on your Synapse workspaces,None,,,,,,,,,,
Tags,Require a tag and its value on resource groups,Required,,,,,,,,,"tagName, tagValue",
Tags,Require a tag and its value on resources,Required,,,,,,,,,"tagName, tagValue",
Tags,Require a tag on resource groups,Required,,,,,,,,,tagName,
Tags,Require a tag on resources,Required,,,,,,,,,tagName,
VM Image Builder,VM Image Builder templates should use private link,None,NS-3,,,,,,,,,https://github.com/Azure/azure-policy/blob/master/built-in-policies/policyDefinitions/VM%20Image%20Builder/PrivateLinkEnabled_Audit.json
