Service,Policy Definition,Parameter Requirements,Azure Security Benchmark,CIS,CCMC L3,ISO 27001,NIST SP 800-53 R4,NIST SP 800-171 R2,HIPAA HITRUST 9.2,New Zealand ISM,Parameters,Link
Kubernetes,Kubernetes cluster pod FlexVolume volumes should only use allowed drivers,Required,,,,,,,,,"excludedNamespaces, namespaces, labelSelector, allowedFlexVolumeDrivers",
Kubernetes,Kubernetes cluster pod hostPath volumes should only use allowed host paths,Required,PV-2,,,,,,,,"excludedNamespaces, namespaces, labelSelector, allowedHostPaths",https://github.com/Azure/azure-policy/blob/master/built-in-policies/policyDefinitions/Kubernetes/AllowedHostPaths.json
Kubernetes,Kubernetes cluster pods and containers should only run with approved user and group IDs,Required,PV-2,,,,,,,,"excludedNamespaces, namespaces, labelSelector, runAsUserRule, runAsUserRanges, runAsGroupRule, runAsGroupRanges, supplementalGroupsRule, supplementalGroupsRanges, fsGroupRule, fsGroupRanges",https://github.com/Azure/azure-policy/blob/master/built-in-policies/policyDefinitions/Kubernetes/AllowedUsersGroups.json
Kubernetes,Kubernetes cluster pods and containers should only use allowed SELinux options,Required,,,,,,,,,"excludedNamespaces, namespaces, labelSelector, allowedSELinuxOptions",
Kubernetes,Kubernetes cluster pods should only use allowed volume types,Required,,,,,,,,,"excludedNamespaces, namespaces, labelSelector, allowedVolumeTypes",
Kubernetes,Kubernetes cluster pods should only use approved host network and port range,Required,PV-2,,,,,,,,"excludedNamespaces, namespaces, labelSelector, allowHostNetwork, minPort, maxPort",https://github.com/Azure/azure-policy/blob/master/built-in-policies/policyDefinitions/Kubernetes/HostNetworkPorts.json
Kubernetes,Kubernetes cluster pods should use specified labels,Required,,,,,,,,,"excludedNamespaces, namespaces, labelSelector, labelsList",
Kubernetes,Kubernetes cluster services should listen only on allowed ports,Required,,,,,,,,,"excludedNamespaces, namespaces, labelSelector, allowedServicePortsList",
Kubernetes,Kubernetes cluster services should only use allowed external IPs,Required,,,,,,,,,"excludedNamespaces, namespaces, labelSelector, allowedExternalIPs",
Kubernetes,Kubernetes cluster should not allow privileged containers,Required,,,,,,,,,"excludedNamespaces, namespaces, labelSelector",
Kubernetes,Kubernetes clusters should be accessible only over HTTPS,Required,DP-4,,,,,,,,"excludedNamespaces, namespaces, labelSelector",https://github.com/Azure/azure-policy/blob/master/built-in-policies/policyDefinitions/Kubernetes/IngressHttpsOnly.json
Kubernetes,Kubernetes clusters should disable automounting API credentials,Required,,,,,,,,,"excludedNamespaces, namespaces, labelSelector",
Kubernetes,Kubernetes clusters should not allow container privilege escalation,Required,PV-2,,,,,,,,"excludedNamespaces, namespaces, labelSelector",https://github.com/Azure/azure-policy/blob/master/built-in-policies/policyDefinitions/Kubernetes/ContainerNoPrivilegeEscalation.json
Kubernetes,Kubernetes clusters should not grant CAP_SYS_ADMIN security capabilities,Required,,,,,,,,,"excludedNamespaces, namespaces, labelSelector",
Kubernetes,Kubernetes clusters should not use specific security capabilities,Required,,,,,,,,,"excludedNamespaces, namespaces, labelSelector, disallowedCapabilities",
Kubernetes,Kubernetes clusters should not use the default namespace,Required,,,,,,,,,"excludedNamespaces, namespaces, labelSelector",
Kubernetes,Kubernetes clusters should use internal load balancers,Required,,,,,,,,,"excludedNamespaces, namespaces, labelSelector",
Kubernetes,Temp disks and cache for agent node pools in Azure Kubernetes Service clusters should be encrypted at host,None,,,,,,,,,,
Lighthouse,Allow managing tenant ids to onboard through Azure Lighthouse,Required,,,,,,,,,listOfAllowedTenants,
Lighthouse,Audit delegation of scopes to a managing tenant,None,,,,,,,,,,
Logic Apps,Resource logs in Logic Apps should be enabled,Optional,LT-4,5.3,,,,,1203.09aa1System.2 - 09.aa,,requiredRetentionDays,https://github.com/Azure/azure-policy/blob/master/built-in-policies/policyDefinitions/Logic%20Apps/LogicApps_AuditDiagnosticLog_Audit.json
Machine Learning,Azure Machine Learning workspaces should be encrypted with a customer-managed key,None,DP-5,,,,,,,,,https://github.com/Azure/azure-policy/blob/master/built-in-policies/policyDefinitions/Machine%20Learning/Workspace_CMKEnabled_Audit.json
Machine Learning,Azure Machine Learning workspaces should use private link,None,NS-3,,,,,,,,,https://github.com/Azure/azure-policy/blob/master/built-in-policies/policyDefinitions/Machine%20Learning/Workspace_PrivateLinkEnabled_Audit.json
Machine Learning,Azure Machine Learning workspaces should use user-assigned managed identity,None,,,,,,,,,,
Machine Learning,Configure allowed Python packages for specified Azure Machine Learning computes,Required,,,,,,,,,"computeNames, allowedPythonPackageChannels",
Machine Learning,Configure allowed module authors for specified Azure Machine Learning computes,Required,,,,,,,,,"computeNames, allowedModuleAuthors",
Machine Learning,Configure allowed registries for specified Azure Machine Learning computes,Required,,,,,,,,,"computeNames, allowedACRs",
Machine Learning,Configure an approval endpoint called prior to jobs running for specified Azure Machine Learning computes,Required,,,,,,,,,"computeNames, approvalEndpoint",
Machine Learning,Configure code signing for training code for specified Azure Machine Learning computes,Required,,,,,,,,,"computeNames, signingKey",
Machine Learning,Configure log filter expressions and datastore to be used for full logs for specified Azure Machine Learning computes,Required,,,,,,,,,"computeNames, logFilters, datastore",
Managed Application,Application definition for Managed Application should use customer provided storage account,None,,,,,,,,,,
Monitoring,Activity log should be retained for at least one year,None,,,,,,,,AC-15,,https://github.com/Azure/azure-policy/blob/master/built-in-policies/policyDefinitions/Monitoring/ActivityLogRetention_365orGreater.json
Monitoring,An activity log alert should exist for specific Administrative operations,Required,,5.2.9,,,,,1271.09ad1System.1 - 09.ad,,operationName,https://github.com/Azure/azure-policy/blob/master/built-in-policies/policyDefinitions/Monitoring/ActivityLog_AdministrativeOperations_Audit.json
Monitoring,An activity log alert should exist for specific Policy operations,Required,,5.2.2,,,,,,,operationName,https://github.com/Azure/azure-policy/blob/master/built-in-policies/policyDefinitions/Monitoring/ActivityLog_PolicyOperations_Audit.json
Monitoring,An activity log alert should exist for specific Security operations,Required,,5.2.8,,,,,,,operationName,https://github.com/Azure/azure-policy/blob/master/built-in-policies/policyDefinitions/Monitoring/ActivityLog_SecurityOperations_Audit.json
Monitoring,Audit Log Analytics workspace for VM - Report Mismatch,Required,,,,,SI-4,3.3.2,,AC-14,logAnalyticsWorkspaceId,https://github.com/Azure/azure-policy/blob/master/built-in-policies/policyDefinitions/Monitoring/LogAnalytics_WorkspaceMismatch_VM_Audit.json
Monitoring,Audit diagnostic setting,Required,,,,A.12.4.4,AU-12,3.3.4,1210.09aa3System.3 - 09.aa,DM-6,listOfResourceTypes,https://github.com/Azure/azure-policy/blob/master/built-in-policies/policyDefinitions/Monitoring/DiagnosticSettingsForTypes_Audit.json
Monitoring,Azure Monitor Logs clusters should be created with infrastructure-encryption enabled (double encryption),None,,,,,,,,,,
Monitoring,Azure Monitor Logs clusters should be encrypted with customer-managed key,None,,,,,,,,,,
Monitoring,Azure Monitor Logs for Application Insights should be linked to a Log Analytics workspace,None,,,,,,,,,,
Monitoring,"Azure Monitor log profile should collect logs for categories 'write,' 'delete,' and 'action'",None,,,,,,,1219.09ab3System.10 - 09.ab,,,https://github.com/Azure/azure-policy/blob/master/built-in-policies/policyDefinitions/Monitoring/ActivityLog_CaptureAllCategories.json
Monitoring,Azure Monitor should collect activity logs from all regions,None,,,,,,,1214.09ab2System.3456 - 09.ab,,,https://github.com/Azure/azure-policy/blob/master/built-in-policies/policyDefinitions/Monitoring/ActivityLog_CaptureAllRegions.json
Monitoring,Azure Monitor solution 'Security and Audit' must be deployed,None,,,,,,,,,,
Monitoring,Azure subscriptions should have a log profile for Activity Log,None,,,,,,,,AC-13,,https://github.com/Azure/azure-policy/blob/master/built-in-policies/policyDefinitions/Monitoring/Logprofile_activityLogs_Audit.json
Monitoring,Dependency agent should be enabled for listed virtual machine images,Required,,,,,,,,,"listOfImageIdToInclude_windows, listOfImageIdToInclude_linux",
Monitoring,Dependency agent should be enabled in virtual machine scale sets for listed virtual machine images,Required,,,,,,,,,"listOfImageIdToInclude_windows, listOfImageIdToInclude_linux",
Monitoring,Log Analytics Agent should be enabled for listed virtual machine images,Required,,,,,,,,,"listOfImageIdToInclude_windows, listOfImageIdToInclude_linux",
Monitoring,Log Analytics agent should be enabled in virtual machine scale sets for listed virtual machine images,Required,,,,,,,,,"listOfImageIdToInclude_windows, listOfImageIdToInclude_linux",
Monitoring,Log Analytics agent should be installed on your Linux Azure Arc machines,None,,,,,,,,,,
Monitoring,Log Analytics agent should be installed on your Windows Azure Arc machines,None,,,,,,,,,,
Monitoring,Network traffic data collection agent should be installed on Linux virtual machines,None,,,,,,,,,,
Monitoring,Network traffic data collection agent should be installed on Windows virtual machines,None,,,,,,,,,,
Monitoring,Saved-queries in Azure Monitor should be saved in customer storage account for logs encryption,None,,,,,,,,,,
Monitoring,Storage account containing the container with activity logs must be encrypted with BYOK,None,,5.1.4,,,,,,,,https://github.com/Azure/azure-policy/blob/master/built-in-policies/policyDefinitions/Monitoring/ActivityLog_StorageAccountBYOK_Audit.json
Monitoring,The Log Analytics agent should be installed on Virtual Machine Scale Sets,None,,,,,,3.3.2,1216.09ab3System.12 - 09.ab,,,https://github.com/Azure/azure-policy/blob/master/built-in-policies/policyDefinitions/Monitoring/VMSS_LogAnalyticsAgent_AuditIfNotExists.json
Monitoring,The Log Analytics agent should be installed on virtual machines,None,,,,,,3.3.2,1215.09ab2System.7 - 09.ab,,,https://github.com/Azure/azure-policy/blob/master/built-in-policies/policyDefinitions/Monitoring/VirtualMachines_LogAnalyticsAgent_AuditIfNotExists.json
Monitoring,Workbooks should be saved to storage accounts that you control,None,,,,,,,,,,
Network,A custom IPsec/IKE policy must be applied to all Azure virtual network gateway connections,Required,,,,,,,,,"IPsecEncryption, IPsecIntegrity, IKEEncryption, IKEIntegrity, DHGroup, PFSGroup",
Network,All Internet traffic should be routed via your deployed Azure Firewall,None,,,,,,,,,,
Network,App Service should use a virtual network service endpoint,None,,,,,,,0861.09m2Organizational.67 - 09.m,,,https://github.com/Azure/azure-policy/blob/master/built-in-policies/policyDefinitions/Network/VirtualNetworkServiceEndpoint_AppService_AuditIfNotExists.json
Network,Azure VPN gateways should not use 'basic' SKU,None,,,,,,,,,,
Network,Container Registry should use a virtual network service endpoint,None,,,,,,,,,,
Network,Cosmos DB should use a virtual network service endpoint,None,,,,,,,0864.09m2Organizational.12 - 09.m,,,https://github.com/Azure/azure-policy/blob/master/built-in-policies/policyDefinitions/Network/VirtualNetworkServiceEndpoint_CosmosDB_Audit.json
Network,Event Hub should use a virtual network service endpoint,None,,,,,,,0863.09m2Organizational.910 - 09.m,,,https://github.com/Azure/azure-policy/blob/master/built-in-policies/policyDefinitions/Network/VirtualNetworkServiceEndpoint_EventHub_AuditIfNotExists.json
Network,Flow logs should be configured for every network security group,None,,,,,,,,,,
Network,Flow logs should be enabled for every network security group,None,,,,,,,,,,
Network,Gateway subnets should not be configured with a network security group,None,,,,,,,0894.01m2Organizational.7 - 01.m,,,https://github.com/Azure/azure-policy/blob/master/built-in-policies/policyDefinitions/Network/NetworkSecurityGroupOnGatewaySubnet_Deny.json
Network,Key Vault should use a virtual network service endpoint,None,,,,,,,0865.09m2Organizational.13 - 09.m,,,https://github.com/Azure/azure-policy/blob/master/built-in-policies/policyDefinitions/Network/VirtualNetworkServiceEndpoint_KeyVault_Audit.json
Network,Network Watcher should be enabled,Required,LT-3,6.5,,,,3.14.6,0888.09n2Organizational.6 - 09.n,,"listOfLocations, resourceGroupName",https://github.com/Azure/azure-policy/blob/master/built-in-policies/policyDefinitions/Network/NetworkWatcher_Enabled_Audit.json
Network,Network interfaces should disable IP forwarding,None,,,,,,,,,,
Network,Network interfaces should not have public IPs,None,,,,,,,,,,
Network,RDP access from the Internet should be blocked,None,NS-4,6.1,,,,,,,,https://github.com/Azure/azure-policy/blob/master/built-in-policies/policyDefinitions/Network/NetworkSecurityGroup_RDPAccess_Audit.json
Network,SQL Server should use a virtual network service endpoint,None,,,,,,,0862.09m2Organizational.8 - 09.m,,,https://github.com/Azure/azure-policy/blob/master/built-in-policies/policyDefinitions/Network/VirtualNetworkServiceEndpoint_SQLServer_AuditIfNotExists.json
Network,SSH access from the Internet should be blocked,None,NS-4,6.2,,,,,,,,https://github.com/Azure/azure-policy/blob/master/built-in-policies/policyDefinitions/Network/NetworkSecurityGroup_SSHAccess_Audit.json
Network,Service Bus should use a virtual network service endpoint,None,,,,,,,0860.09m1Organizational.9 - 09.m,,,https://github.com/Azure/azure-policy/blob/master/built-in-policies/policyDefinitions/Network/VirtualNetworkServiceEndpoint_ServiceBus_AuditIfNotExists.json
Network,Storage Accounts should use a virtual network service endpoint,None,,,,,,,0867.09m3Organizational.17 - 09.m,,,https://github.com/Azure/azure-policy/blob/master/built-in-policies/policyDefinitions/Network/VirtualNetworkServiceEndpoint_StorageAccount_Audit.json
Network,Virtual machines should be connected to an approved virtual network,Required,,,,,,,0814.01n1Organizational.12 - 01.n,,virtualNetworkId,https://github.com/Azure/azure-policy/blob/master/built-in-policies/policyDefinitions/Network/ApprovedVirtualNetwork_Audit.json
Network,Virtual networks should use specified virtual network gateway,Required,,,,,,,,,virtualNetworkGatewayId,
Network,Web Application Firewall (WAF) should be enabled for Application Gateway,None,NS-4,,,,,,,NS-7,,https://github.com/Azure/azure-policy/blob/master/built-in-policies/policyDefinitions/Network/WAF_AppGatewayEnabled_Audit.json
Network,Web Application Firewall (WAF) should be enabled for Azure Front Door Service service,None,NS-4,,,,,,,NS-7,,https://github.com/Azure/azure-policy/blob/master/built-in-policies/policyDefinitions/Network/WAF_AFD_Enabled_Audit.json
Network,Web Application Firewall (WAF) should use the specified mode for Application Gateway,Optional,,,,,,,,NS-7,modeRequirement,https://github.com/Azure/azure-policy/blob/master/built-in-policies/policyDefinitions/Network/WAF_AppGatewayMode_Audit.json
Network,Web Application Firewall (WAF) should use the specified mode for Azure Front Door Service,Optional,,,,,,,,NS-7,modeRequirement,https://github.com/Azure/azure-policy/blob/master/built-in-policies/policyDefinitions/Network/WAF_AFD_Mode_Audit.json
Portal,Shared dashboards should not have markdown tiles with inline content,None,,,,,,,,,,
SQL,Advanced data security should be enabled on SQL Managed Instance,None,IR-5,4.2.1,,,SI-4,3.14.6,,DM-6,,https://github.com/Azure/azure-policy/blob/master/built-in-policies/policyDefinitions/SQL/SqlManagedInstance_AdvancedDataSecurity_Audit.json
SQL,Advanced data security should be enabled on your SQL servers,None,,4.2.1,,,SI-4,3.14.6,,DM-6,,https://github.com/Azure/azure-policy/blob/master/built-in-policies/policyDefinitions/SQL/SqlServer_AdvancedDataSecurity_Audit.json
SQL,An Azure Active Directory administrator should be provisioned for SQL servers,None,IM-1,4.4,,A.9.2.3,AC-2 (7),,,DM-6,,https://github.com/Azure/azure-policy/blob/master/built-in-policies/policyDefinitions/SQL/SQL_DB_AuditServerADAdmins_Audit.json
SQL,Auditing on SQL server should be enabled,Optional,LT-4,4.1.1,,A.12.4.4,AU-12,3.3.4,1211.09aa3System.4 - 09.aa,,setting,https://github.com/Azure/azure-policy/blob/master/built-in-policies/policyDefinitions/SQL/SqlServerAuditing_Audit.json
SQL,Azure SQL Database should have the minimal TLS version of 1.2,None,,,,,,,,,,
SQL,Bring your own key data protection should be enabled for MySQL servers,None,DP-5,,,,,,,,,https://github.com/Azure/azure-policy/blob/master/built-in-policies/policyDefinitions/SQL/MySQL_EnableByok_Audit.json
SQL,Bring your own key data protection should be enabled for PostgreSQL servers,None,DP-5,,,,,,,,,https://github.com/Azure/azure-policy/blob/master/built-in-policies/policyDefinitions/SQL/PostgreSQL_EnableByok_Audit.json
SQL,Connection throttling should be enabled for PostgreSQL database servers,None,,4.3.6,,,,,,,,https://github.com/Azure/azure-policy/blob/master/built-in-policies/policyDefinitions/SQL/PostgreSQL_ConnectionThrottling_Enabled_Audit.json
SQL,Disconnections should be logged for PostgreSQL database servers.,None,,4.3.5,,,,,,,,https://github.com/Azure/azure-policy/blob/master/built-in-policies/policyDefinitions/SQL/PostgreSQL_EnableLogDisconnections_Audit.json
SQL,Enforce SSL connection should be enabled for MySQL database servers,None,DP-4,4.3.1,,,,,0948.09y2Organizational.3 - 09.y,,,https://github.com/Azure/azure-policy/blob/master/built-in-policies/policyDefinitions/SQL/MySQL_EnableSSL_Audit.json
SQL,Enforce SSL connection should be enabled for PostgreSQL database servers,None,DP-4,4.3.2,,,,,0947.09y2Organizational.2 - 09.y,,,https://github.com/Azure/azure-policy/blob/master/built-in-policies/policyDefinitions/SQL/PostgreSQL_EnableSSL_Audit.json
SQL,Geo-redundant backup should be enabled for Azure Database for MariaDB,None,BR-2,,,,,,1627.09l3Organizational.6 - 09.l,,,https://github.com/Azure/azure-policy/blob/master/built-in-policies/policyDefinitions/SQL/GeoRedundant_DBForMariaDB_Audit.json
SQL,Geo-redundant backup should be enabled for Azure Database for MySQL,None,BR-2,,,,,,1622.09l2Organizational.23 - 09.l,,,https://github.com/Azure/azure-policy/blob/master/built-in-policies/policyDefinitions/SQL/GeoRedundant_DBForMySQL_Audit.json
SQL,Geo-redundant backup should be enabled for Azure Database for PostgreSQL,None,BR-2,,,,,,1626.09l3Organizational.5 - 09.l,,,https://github.com/Azure/azure-policy/blob/master/built-in-policies/policyDefinitions/SQL/GeoRedundant_DBForPostgreSQL_Audit.json
SQL,Infrastructure encryption should be enabled for Azure Database for MySQL servers,None,,,,,,,,,,https://github.com/Azure/azure-policy/blob/master/built-in-policies/policyDefinitions/SQL/MySQL_InfrastructureEncryption_Audit.json
SQL,Infrastructure encryption should be enabled for Azure Database for PostgreSQL servers,None,,,,,,,,,,https://github.com/Azure/azure-policy/blob/master/built-in-policies/policyDefinitions/SQL/PostgreSQL_InfrastructureEncryption_Audit.json
SQL,Log checkpoints should be enabled for PostgreSQL database servers,None,,4.3.3,,,,,,,,https://github.com/Azure/azure-policy/blob/master/built-in-policies/policyDefinitions/SQL/PostgreSQL_EnableLogCheckpoint_Audit.json
SQL,Log connections should be enabled for PostgreSQL database servers,None,,4.3.4,,,,,,,,https://github.com/Azure/azure-policy/blob/master/built-in-policies/policyDefinitions/SQL/PostgreSQL_EnableLogConnections_Audit.json
SQL,Log duration should be enabled for PostgreSQL database servers,None,,,,,,,,,,
SQL,Long-term geo-redundant backup should be enabled for Azure SQL Databases,None,BR-2,,,,,,1621.09l2Organizational.1 - 09.l,,,https://github.com/Azure/azure-policy/blob/master/built-in-policies/policyDefinitions/SQL/GeoRedundant_SQLDatabase_AuditIfNotExists.json
SQL,MariaDB server should use a virtual network service endpoint,None,,,,,,,,,,
SQL,MySQL server should use a virtual network service endpoint,None,,,,,,,,,,
SQL,PostgreSQL server should use a virtual network service endpoint,None,,,,,,,,,,
SQL,Private endpoint connections on Azure SQL Database should be enabled,None,NS-3,,,,,,,,,https://github.com/Azure/azure-policy/blob/master/built-in-policies/policyDefinitions/SQL/SqlServer_PrivateEndpoint_Audit.json
SQL,Private endpoint should be enabled for MariaDB servers,None,NS-3,,,,,,,,,https://github.com/Azure/azure-policy/blob/master/built-in-policies/policyDefinitions/SQL/MariaDB_EnablePrivateEndPoint_Audit.json
SQL,Private endpoint should be enabled for MySQL servers,None,NS-3,,,,,,,,,https://github.com/Azure/azure-policy/blob/master/built-in-policies/policyDefinitions/SQL/MySQL_EnablePrivateEndPoint_Audit.json
SQL,Private endpoint should be enabled for PostgreSQL servers,None,NS-3,,,,,,,,,https://github.com/Azure/azure-policy/blob/master/built-in-policies/policyDefinitions/SQL/PostgreSQL_EnablePrivateEndPoint_Audit.json
SQL,Public network access on Azure SQL Database should be disabled,None,NS-1,,,,,,,,,https://github.com/Azure/azure-policy/blob/master/built-in-policies/policyDefinitions/SQL/SqlServer_PublicNetworkAccess_Audit.json
SQL,Public network access should be disabled for MariaDB servers,None,NS-1,,,,,,,,,https://github.com/Azure/azure-policy/blob/master/built-in-policies/policyDefinitions/SQL/MariaDB_DisablePublicNetworkAccess_Audit.json
SQL,Public network access should be disabled for MySQL flexible servers,None,,,,,,,,,,https://github.com/Azure/azure-policy/blob/master/built-in-policies/policyDefinitions/SQL/MySQL_FlexibleServers_DisablePublicNetworkAccess_Audit.json
SQL,Public network access should be disabled for MySQL servers,None,NS-1,,,,,,,,,https://github.com/Azure/azure-policy/blob/master/built-in-policies/policyDefinitions/SQL/MySQL_DisablePublicNetworkAccess_Audit.json
SQL,Public network access should be disabled for PostgreSQL flexible servers,None,,,,,,,,,,https://github.com/Azure/azure-policy/blob/master/built-in-policies/policyDefinitions/SQL/PostgreSQL_FlexibleServers_DisablePublicNetworkAccess_Audit.json
SQL,Public network access should be disabled for PostgreSQL servers,None,NS-1,,,,,,,,,https://github.com/Azure/azure-policy/blob/master/built-in-policies/policyDefinitions/SQL/PostgreSQL_DisablePublicNetworkAccess_Audit.json
SQL,SQL Auditing settings should have Action-Groups configured to capture critical activities,None,,,,,,,,,,
SQL,SQL Database should avoid using GRS backup redundancy,None,,,,,,,,,,
SQL,SQL Managed Instance should have the minimal TLS version of 1.2,None,,,,,,,,,,
SQL,SQL Managed Instances should avoid using GRS backup redundancy,None,,,,,,,,,,
SQL,SQL managed instances should use customer-managed keys to encrypt data at rest,None,DP-5,4.5,,,,,0304.09o3Organizational.1 - 09.o,,,https://github.com/Azure/azure-policy/blob/master/built-in-policies/policyDefinitions/SQL/SqlManagedInstance_EnsureServerTDEisEncryptedWithYourOwnKey_Audit.json
SQL,SQL servers should retain audit data for at least 90 days,None,,,,,,,,,,
SQL,SQL servers should use customer-managed keys to encrypt data at rest,None,DP-5,4.5,,,,,0304.09o3Organizational.1 - 09.o,,,https://github.com/Azure/azure-policy/blob/master/built-in-policies/policyDefinitions/SQL/SqlServer_EnsureServerTDEisEncryptedWithYourOwnKey_Audit.json
SQL,Transparent Data Encryption on SQL databases should be enabled,None,DP-5,4.1.2,,A.10.1.1,SC-28 (1),3.13.16,0301.09o1Organizational.123 - 09.o,DM-6,,https://github.com/Azure/azure-policy/blob/master/built-in-policies/policyDefinitions/SQL/SqlDBEncryption_Audit.json
SQL,Virtual network firewall rule on Azure SQL Database should be enabled to allow traffic from the specified subnet,Required,,,,,,,,,subnetId,
SQL,Vulnerability Assessment settings for SQL server should contain an email address to receive scan reports,None,,4.2.4,,,,,,ISM-3,,https://github.com/Azure/azure-policy/blob/master/built-in-policies/policyDefinitions/SQL/SqlServer_VulnerabilityAssessmentEmails_Audit.json
SQL,Vulnerability assessment should be enabled on SQL Managed Instance,None,PV-6,4.2.2,,,,,0719.10m3Organizational.5 - 10.m,ISM-3,,https://github.com/Azure/azure-policy/blob/master/built-in-policies/policyDefinitions/SQL/VulnerabilityAssessmentOnManagedInstance_Audit.json
SQL,Vulnerability assessment should be enabled on your SQL servers,None,PV-6,4.2.2,,,,,0709.10m1Organizational.1 - 10.m,ISM-3,,https://github.com/Azure/azure-policy/blob/master/built-in-policies/policyDefinitions/SQL/VulnerabilityAssessmentOnServer_Audit.json
Search,Azure Cognitive Search service should use a SKU that supports private link,None,,,,,,,,,,
Search,Azure Cognitive Search services should disable public network access,None,,,,,,,,,,
Search,Resource logs in Search services should be enabled,Optional,LT-4,5.3,,,,,1208.09aa3System.1 - 09.aa,,requiredRetentionDays,https://github.com/Azure/azure-policy/blob/master/built-in-policies/policyDefinitions/Search/Search_AuditDiagnosticLog_Audit.json
Security Center,A maximum of 3 owners should be designated for your subscription,None,PA-1,,,A.6.1.2,AC-6 (7),3.1.4,11112.01q2Organizational.67 - 01.q,AC-2,,https://github.com/Azure/azure-policy/blob/master/built-in-policies/policyDefinitions/Security%20Center/ASC_DesignateLessThanXOwners_Audit.json
Security Center,A vulnerability assessment solution should be enabled on your virtual machines,None,PV-6,,,A.12.6.1,SI-2,3.14.1,0711.10m2Organizational.23 - 10.m,ISM-3,,https://github.com/Azure/azure-policy/blob/master/built-in-policies/policyDefinitions/Security%20Center/ASC_ServerVulnerabilityAssessment_Audit.json
